{
  "$schema": "../../schema/schema.json",
  "id": "gux-horizontal-poster-title-overlay",
  "version": "0.1.0",
  "displayName": "GUX 가로포스터 타이틀 오버레이 (832x468)",
  "description": "GUX 가로포스터(832x468) 배경 위에 타이틀 로고(600x160 원본, 실측 안전영역 360x160)를 합성하는 템플릿. dev-template-automation Step 0~4 실측 기반, filename-contract 방식(GUX_가로포스터_IMG/LOGO 파일명 페어링)으로 발견/검증됨.",
  "status": "draft",
  "platforms": ["web"],
  "tokens": {},
  "props": {
    "backgroundImageUrl": {
      "type": "string",
      "required": true,
      "description": "backdrop 슬롯, Dam에서 title-key로 조회한 IMG(832x468 jpg)"
    },
    "titleOverlayImageUrl": {
      "type": "string",
      "required": true,
      "description": "title_overlay 슬롯, Dam에서 title-key로 조회한 LOGO(600x160 png)"
    },
    "titleOverlayAlt": {
      "type": "string",
      "required": true,
      "description": "접근성 대체 텍스트. 소싱 규칙: 1순위 title-key 원본 제목 문자열, 2순위(원본 제목 미확보 시) 에셋 파일명에서 역파싱한 제목(예: [GUX_가로포스터_LOGO]600x160_<제목>.png의 <제목> 캡처값)"
    }
  },
  "states": ["default"],
  "variants": [
    { "id": "default", "displayName": "기본", "props": {} }
  ],
  "slots": [
    {
      "id": "backdrop",
      "role": "background",
      "kind": "image",
      "bbox": { "x": 0, "y": 0, "w": 832, "h": 468 },
      "fixedSize": true,
      "isRequired": true
    },
    {
      "id": "title_overlay",
      "role": "title_overlay",
      "kind": "image",
      "bbox": { "x": 40, "y": 267, "w": 360, "h": 160 },
      "bboxNormalized": { "x": 0.048, "y": 0.5705, "w": 0.4327, "h": 0.3419 },
      "fixedSize": true,
      "isRequired": true
    }
  ],
  "constraints": {
    "text": {
      "maxLength": 17,
      "overflow": "reject"
    },
    "safeArea": [
      { "slotId": "title_overlay", "note": "얼굴/주요 피사체 충돌 검수 대상 — Step 9(safe-area-gate)에서 tmdb_ref_faces 연동 예정, 이번 계약은 참조만" }
    ]
  },
  "rendering": {
    "baseCanvas": { "width": 832, "height": 468 },
    "outputFormats": ["jpg"]
  },
  "x-dam": {
    "assetQuery": {
      "method": "filename-contract-title-key",
      "backdrop": { "facet": "GUX_가로포스터_IMG", "resolution": "832x468", "ext": "jpg" },
      "titleOverlay": { "facet": "GUX_가로포스터_LOGO", "resolution": "600x160", "ext": "png" },
      "pairing": "title-key 정규화 후 1:1 매칭 (Step3 기준 37.2%, 13,618쌍 검증됨)"
    },
    "sourceCohort": "GUX_가로포스터_832x468_v1 (Step2 CLIP 동질성 검증, threshold=0.3478, n=36595)",
    "provenance": {
      "gate3_note": "GATE3 sibling/CR-npz 매칭(43%)은 본 계약이 쓰는 방식이 아님 — 별개 메커니즘, FAIL이 이 계약에 적용되지 않음",
      "gate_verdict_used": "filename-contract approach — GO (step0_feasibility.md 종합판정)",
      "steps": ["step0_feasibility.md", "step1_ranking.json", "step2_cohort", "step3_slots.json", "step4_tokens.json"]
    }
  },
  "usage": {
    "do": [],
    "dont": ["UHD/수어 배지 variant를 이 계약으로 처리하지 말 것 — v0.2.0에서 별도 검증 후 확장 예정"]
  },
  "changelog": [
    {
      "version": "0.1.0",
      "date": "2026-07-30",
      "changes": [
        "dev-template-automation Step 6 초안 — backdrop/title_overlay 슬롯만 정의, 배지(UHD/수어) 제외"
      ]
    }
  ]
}
